{
  "schema_version": "1.0.0",
  "plant_id": 1157,
  "source": {
    "raw_file": "raw/plant_1157.html",
    "metadata_file": "metadata/plant_1157.json",
    "endpoint": "https://zd.plantdata.athsoftware.com/Home/GetDashboardData?plantId=1157",
    "http_status": 200,
    "dropdown_label": "Sun Pharmaceuticals Ltd - 2097 (PTRO)  - 125"
  },
  "plant": {
    "name": "sun pharmaceuticals ltd",
    "serial_number": "2097",
    "capacity": "125",
    "site_contact_number": "9376447917"
  },
  "zone": "Panoli",
  "modules": {
    "stage_1": "7(PT)",
    "stage_2": "8(PT)",
    "stage_3": "8(PT)",
    "stage_4": "0",
    "stage_5": "0",
    "total": "23"
  },
  "design_parameters": [
    {
      "position": 1,
      "name": "Feed Flow",
      "unit": "m³/Hr",
      "unit_raw": "(m³/Hr)",
      "value": "6.3"
    },
    {
      "position": 2,
      "name": "Feed Flow",
      "unit": "m³/Hr",
      "unit_raw": "(m³/Hr)",
      "value": "6.3"
    },
    {
      "position": 3,
      "name": "Feed Conductivity",
      "unit": "µS/CM",
      "unit_raw": "(µS/CM)",
      "value": "11200 - 16800"
    },
    {
      "position": 4,
      "name": "Feed TDS",
      "unit": "PPM",
      "unit_raw": "(PPM)",
      "value": "8000 - 12000"
    },
    {
      "position": 5,
      "name": "Feed COD",
      "unit": "PPM",
      "unit_raw": "(PPM)",
      "value": "700 -1000"
    },
    {
      "position": 6,
      "name": "Feed Turbidity",
      "unit": "NTU",
      "unit_raw": "(NTU)",
      "value": "20"
    },
    {
      "position": 7,
      "name": "Permeate Flow",
      "unit": "m³/Hr",
      "unit_raw": "(m³/Hr)",
      "value": "4.4"
    },
    {
      "position": 8,
      "name": "Permeate Conductivity",
      "unit": "µS/CM",
      "unit_raw": "(µS/CM)",
      "value": "1500"
    },
    {
      "position": 9,
      "name": "Permeate TDS",
      "unit": "PPM",
      "unit_raw": "(PPM)",
      "value": "750"
    },
    {
      "position": 10,
      "name": "Permeate COD",
      "unit": "PPM",
      "unit_raw": "(PPM)",
      "value": "100-200"
    },
    {
      "position": 11,
      "name": "Recovery",
      "unit": "%",
      "unit_raw": "(%)",
      "value": "70"
    }
  ],
  "pump_and_motor": [
    {
      "pump_code": "PK131",
      "pump_make": "GRUNDFOS",
      "pump_model": "CRN 10-4",
      "motor_make": "GRUNDFOS",
      "motor_kw": "1.5",
      "motor_amp": "3"
    }
  ],
  "instruments": [
    {
      "name": "Feed Flow Trans.",
      "make": "Georg Fischer",
      "model": "3-2536-P0"
    },
    {
      "name": "Perm. Flow Trans.",
      "make": "Georg Fischer",
      "model": "3-2536-P0"
    },
    {
      "name": "Feed Cond. Meter",
      "make": "EUTECH",
      "model": "THERMO 560"
    },
    {
      "name": "Perm. Cond. Meter",
      "make": "EUTECH",
      "model": "THERMO 560"
    },
    {
      "name": "Feed pH Meter",
      "make": "Georg Fischer",
      "model": "SIGNET 2751"
    }
  ],
  "hmi_and_plc": [
    {
      "name": "HMI & PLC",
      "make": "SCHNEIDER",
      "model": "DLCDA 40 DRF"
    },
    {
      "name": "HMI & PLC",
      "make": "SCHNEIDER",
      "model": "XBTN 401"
    }
  ],
  "vfd": [
    {
      "name": "VFD",
      "make": "YASAKWA",
      "model": "J-1000"
    },
    {
      "name": "VFD",
      "make": "YASAKWA",
      "model": "J-1000"
    }
  ],
  "dosing_pumps": [
    {
      "dosing_pump_for": "HCL",
      "make": "PROMINENT",
      "model": "PSMA10100PP"
    },
    {
      "dosing_pump_for": "Antiscalant",
      "make": "E-DOSE",
      "model": "IMP 64"
    }
  ],
  "hp_pump_accessories": [
    {
      "position": 1,
      "group": "PD120",
      "entries": [
        {
          "label": "DOSING PUMP FOR",
          "value": "Antiscalant"
        },
        {
          "label": null,
          "value": null
        }
      ]
    },
    {
      "position": 2,
      "group": "MOTOR",
      "entries": [
        {
          "label": "Pully",
          "value": "SPA 150*4A"
        },
        {
          "label": null,
          "value": null
        }
      ]
    },
    {
      "position": 3,
      "group": "PUMP",
      "entries": [
        {
          "label": "Pully",
          "value": "SPA*180 4A"
        },
        {
          "label": "TAPPER",
          "value": "2517"
        }
      ]
    },
    {
      "position": 4,
      "group": "Pulsation Damper",
      "entries": [
        {
          "label": "Pulsation Damper",
          "value": "2 Ltr"
        },
        {
          "label": null,
          "value": null
        }
      ]
    }
  ],
  "filters": [
    {
      "position": 1,
      "name": "Sand Filter",
      "values": [
        "PAINTER",
        "3072",
        "NA",
        "NA"
      ]
    },
    {
      "position": 2,
      "name": "Cartridge Filter",
      "values": [
        "30\"",
        "SS",
        "NA",
        "NA"
      ]
    }
  ],
  "legacy_counts": {
    "pump_and_motor": 1,
    "instruments": 5,
    "hmi_and_plc": 2,
    "vfd": 2,
    "dosing_pumps": 2,
    "hp_pump_accessories": 4,
    "filters": 2
  }
}
