{
  "schema_version": "1.0.0",
  "plant_id": 6,
  "source": {
    "raw_file": "raw/plant_6.html",
    "metadata_file": "metadata/plant_6.json",
    "endpoint": "https://zd.plantdata.athsoftware.com/Home/GetDashboardData?plantId=6",
    "http_status": 200,
    "dropdown_label": "Concord Biotech Ltd. - Dholka - 2988 (PTRO3)  - 150W"
  },
  "plant": {
    "name": "concord biotech ltd. - dholka",
    "serial_number": "2988",
    "capacity": "150w",
    "site_contact_number": "9081817994"
  },
  "zone": "Ahmedabad",
  "modules": {
    "stage_1": "9(HPRO)",
    "stage_2": "10(HPRO)",
    "stage_3": "9(HPRO)",
    "stage_4": "0",
    "stage_5": "0",
    "total": "28"
  },
  "design_parameters": [
    {
      "position": 1,
      "name": "Feed Flow",
      "unit": "m³/Hr.",
      "unit_raw": "(m³/Hr.)",
      "value": "6.8"
    },
    {
      "position": 2,
      "name": "Feed Conductivity",
      "unit": "µS/CM",
      "unit_raw": "(µS/CM)",
      "value": "76.30"
    },
    {
      "position": 3,
      "name": "Feed TDS",
      "unit": "ppm",
      "unit_raw": "(ppm)",
      "value": "5450"
    },
    {
      "position": 4,
      "name": "Feed COD",
      "unit": "mg/ltr.",
      "unit_raw": "(mg/ltr.)",
      "value": "250-500"
    },
    {
      "position": 5,
      "name": "Feed Hardness",
      "unit": "PPM",
      "unit_raw": "(PPM)",
      "value": "100"
    },
    {
      "position": 6,
      "name": "Feed Turbidity",
      "unit": "NTU",
      "unit_raw": "(NTU)",
      "value": "20-50"
    },
    {
      "position": 7,
      "name": "Permeate Flow",
      "unit": "m³/Hr.",
      "unit_raw": "(m³/Hr.)",
      "value": "5.8"
    },
    {
      "position": 8,
      "name": "Permeate Conductivity",
      "unit": "µS/CM",
      "unit_raw": "(µS/CM)",
      "value": "500"
    },
    {
      "position": 9,
      "name": "Permeate TDS",
      "unit": "ppm",
      "unit_raw": "(ppm)",
      "value": "300"
    },
    {
      "position": 10,
      "name": "Permeate COD",
      "unit": "mg/ltr.",
      "unit_raw": "(mg/ltr.)",
      "value": "25"
    },
    {
      "position": 11,
      "name": "Permeate Hardness",
      "unit": "mg/ltr.",
      "unit_raw": "(mg/ltr.)",
      "value": "100"
    },
    {
      "position": 12,
      "name": "Recovery",
      "unit": "%",
      "unit_raw": "(%)",
      "value": "85"
    }
  ],
  "pump_and_motor": [
    {
      "pump_code": "PK121",
      "pump_make": "GRUNDFOS",
      "pump_model": "CRN 10-4",
      "motor_make": "GRUNDFOS",
      "motor_kw": "1.5",
      "motor_amp": "3.15"
    },
    {
      "pump_code": "PK131",
      "pump_make": "GRUNDFOS",
      "pump_model": "CRN 10-5",
      "motor_make": "GRUNDFOS",
      "motor_kw": "2.2",
      "motor_amp": "4.45"
    },
    {
      "pump_code": "PK1601",
      "pump_make": "CAT",
      "pump_model": "3541",
      "motor_make": "SIEMENS",
      "motor_kw": "18.5",
      "motor_amp": "36"
    },
    {
      "pump_code": "PK162",
      "pump_make": "SHAKTI",
      "pump_model": "SP 8A-25N",
      "motor_make": "SHAKTI",
      "motor_kw": "4",
      "motor_amp": "8.43"
    },
    {
      "pump_code": "PK163",
      "pump_make": "SHAKTI",
      "pump_model": "SP 8A-25N",
      "motor_make": "SHAKTI",
      "motor_kw": "4",
      "motor_amp": "8.43"
    },
    {
      "pump_code": "PK185",
      "pump_make": "GRUNDFOS",
      "pump_model": "CRN 5-4",
      "motor_make": "GRUNDFOS",
      "motor_kw": "0.55",
      "motor_amp": "1.44"
    },
    {
      "pump_code": "PK195",
      "pump_make": "GRUNDFOS",
      "pump_model": "CRN 5-5",
      "motor_make": "GRUNDFOS",
      "motor_kw": "0.75",
      "motor_amp": "1.9"
    }
  ],
  "instruments": [
    {
      "name": "Feed Flow Trans.",
      "make": "Georg Fischer",
      "model": "3-2536-P0"
    },
    {
      "name": "Perm. Flow Trans.",
      "make": "Georg Fischer",
      "model": "3-2536-P1"
    },
    {
      "name": "Feed Cond. Meter",
      "make": "EUTECH",
      "model": "ALPHA CON 560"
    },
    {
      "name": "Perm. Cond. Meter",
      "make": "DELACUA",
      "model": "PCC-043"
    },
    {
      "name": "Feed pH Meter",
      "make": "DELACUA",
      "model": "PCC-065"
    },
    {
      "name": "SMCV",
      "make": "PS AUTOMATION",
      "model": null
    },
    {
      "name": "Pressure Switch",
      "make": "ORION",
      "model": "MZ-10 / MZ-7"
    }
  ],
  "hmi_and_plc": [
    {
      "name": "HMI & PLC",
      "make": "SCHNEIDER",
      "model": "HMISTO715"
    },
    {
      "name": "HMI & PLC",
      "make": "SCHNEIDER",
      "model": "TM221C40T"
    }
  ],
  "vfd": [
    {
      "name": "VFD",
      "make": "YASAKWA",
      "model": "J-1000"
    },
    {
      "name": "VFD",
      "make": "YASAKWA",
      "model": "J-1000"
    }
  ],
  "dosing_pumps": null,
  "hp_pump_accessories": null,
  "filters": null,
  "legacy_counts": {
    "pump_and_motor": 7,
    "instruments": 7,
    "hmi_and_plc": 2,
    "vfd": 2,
    "dosing_pumps": null,
    "hp_pump_accessories": null,
    "filters": null
  }
}
