{
  "schema_version": "1.0.0",
  "plant_id": 1027,
  "source": {
    "raw_file": "raw/plant_1027.html",
    "metadata_file": "metadata/plant_1027.json",
    "endpoint": "https://zd.plantdata.athsoftware.com/Home/GetDashboardData?plantId=1027",
    "http_status": 200,
    "dropdown_label": "Sigachi Industries Limited - 3672 (HPRO)  - 75W"
  },
  "plant": {
    "name": "sigachi industries limited",
    "serial_number": "3672",
    "capacity": "75w",
    "site_contact_number": "9714629245"
  },
  "zone": "Dahej",
  "modules": {
    "stage_1": "5(PT)",
    "stage_2": "10(PT)",
    "stage_3": "12(PT)",
    "stage_4": "0",
    "stage_5": "0",
    "total": "27"
  },
  "design_parameters": [
    {
      "position": 1,
      "name": "Feed Flow",
      "unit": "m³/Hr.",
      "unit_raw": "(m³/Hr.)",
      "value": "3.7m3"
    },
    {
      "position": 2,
      "name": "Feed Conductivity",
      "unit": "µS/CM",
      "unit_raw": "(µS/CM)",
      "value": "29645"
    },
    {
      "position": 3,
      "name": "Feed TDS",
      "unit": "ppm",
      "unit_raw": "(ppm)",
      "value": "21175"
    },
    {
      "position": 4,
      "name": "Feed COD",
      "unit": "mg/ltr.",
      "unit_raw": "(mg/ltr.)",
      "value": "0"
    },
    {
      "position": 5,
      "name": "Feed Hardness",
      "unit": "PPM",
      "unit_raw": "(PPM)",
      "value": "0"
    },
    {
      "position": 6,
      "name": "Feed Turbidity",
      "unit": "NTU",
      "unit_raw": "(NTU)",
      "value": "<20"
    },
    {
      "position": 7,
      "name": "Permeate Flow",
      "unit": "m³/Hr.",
      "unit_raw": "(m³/Hr.)",
      "value": "2.8"
    },
    {
      "position": 8,
      "name": "Permeate Conductivity",
      "unit": "µS/CM",
      "unit_raw": "(µS/CM)",
      "value": "2120"
    },
    {
      "position": 9,
      "name": "Permeate TDS",
      "unit": "ppm",
      "unit_raw": "(ppm)",
      "value": "1930"
    },
    {
      "position": 10,
      "name": "Permeate COD",
      "unit": "mg/ltr.",
      "unit_raw": "(mg/ltr.)",
      "value": "0"
    },
    {
      "position": 11,
      "name": "Permeate Hardness",
      "unit": "mg/ltr.",
      "unit_raw": "(mg/ltr.)",
      "value": "0"
    },
    {
      "position": 12,
      "name": "Recovery",
      "unit": "%",
      "unit_raw": "(%)",
      "value": "75"
    }
  ],
  "pump_and_motor": [
    {
      "pump_code": "PK131",
      "pump_make": "GRUNDFOS",
      "pump_model": "CRN 5-6",
      "motor_make": "GRUNDFOS",
      "motor_kw": "1.1",
      "motor_amp": "2.5"
    },
    {
      "pump_code": "PP1601",
      "pump_make": "CAT",
      "pump_model": "3537",
      "motor_make": "NA",
      "motor_kw": "15",
      "motor_amp": "30"
    },
    {
      "pump_code": "PK162",
      "pump_make": "GRUNDFOS",
      "pump_model": "SP 11-15R",
      "motor_make": "GRUNDFOS",
      "motor_kw": "5.5",
      "motor_amp": "13.4"
    },
    {
      "pump_code": "PK163",
      "pump_make": "GRUNDFOS",
      "pump_model": "SP 11-15R",
      "motor_make": "GRUNDFOS",
      "motor_kw": "5.5",
      "motor_amp": "13.4"
    },
    {
      "pump_code": "PK195",
      "pump_make": "GRUNDFOS",
      "pump_model": "CRN 5-4",
      "motor_make": "GRUNDFOS",
      "motor_kw": "0.55",
      "motor_amp": "1.44"
    }
  ],
  "instruments": [
    {
      "name": "Feed Flow Trans.",
      "make": "GEORG FISCHER",
      "model": "PADDEL WHEEL 2536*0"
    },
    {
      "name": "Perm. Flow Trans.",
      "make": "GEORG FISCHER",
      "model": "PADDEL WHEEL 2536*0"
    },
    {
      "name": "Feed Cond. Meter",
      "make": "EUTECH",
      "model": "ALPHA 560"
    },
    {
      "name": "Perm. Cond. Meter",
      "make": "EUTECH",
      "model": "ALPHA 560"
    }
  ],
  "hmi_and_plc": [
    {
      "name": "HMI",
      "make": "SCHNEIDER",
      "model": "3512"
    },
    {
      "name": "PLC",
      "make": "SCHNEIDER",
      "model": "TM200"
    }
  ],
  "vfd": [
    {
      "name": "VFD",
      "make": "Yaskawa",
      "model": "V-1000"
    }
  ],
  "dosing_pumps": [
    {
      "dosing_pump_for": "Acid Dosing",
      "make": "Prominent",
      "model": "PsMa10010"
    },
    {
      "dosing_pump_for": "Antiscalant Dosing",
      "make": "Prominent",
      "model": "PsMa10010"
    }
  ],
  "hp_pump_accessories": [
    {
      "position": 1,
      "group": "Motor",
      "entries": [
        {
          "label": "Pully",
          "value": "SPA 118*4"
        },
        {
          "label": "Tapper",
          "value": "2012*48 BORE"
        }
      ]
    },
    {
      "position": 2,
      "group": "Pump",
      "entries": [
        {
          "label": "Pully",
          "value": "SPA 236*4"
        },
        {
          "label": "Tapper",
          "value": "3020*35 BORE"
        }
      ]
    },
    {
      "position": 3,
      "group": "Pulsation Damper",
      "entries": [
        {
          "label": null,
          "value": "NA"
        },
        {
          "label": null,
          "value": "NA"
        },
        {
          "label": "V-Belt",
          "value": "spax 1550"
        }
      ]
    }
  ],
  "filters": [
    {
      "position": 1,
      "name": "Sand Filter",
      "values": [
        "24*72",
        "1",
        "NA",
        "ROCHEM"
      ]
    },
    {
      "position": 2,
      "name": "Bag Filter",
      "values": [
        "NA",
        "NA",
        "NA",
        "NA"
      ]
    },
    {
      "position": 3,
      "name": "Cartridge Filter",
      "values": [
        "30\"",
        "7",
        "NA",
        "ROCHEM"
      ]
    },
    {
      "position": 4,
      "name": "D/A Filter",
      "values": [
        "NA",
        "NA",
        "NA",
        "NA"
      ]
    }
  ],
  "legacy_counts": {
    "pump_and_motor": 5,
    "instruments": 4,
    "hmi_and_plc": 2,
    "vfd": 1,
    "dosing_pumps": 2,
    "hp_pump_accessories": 3,
    "filters": 4
  }
}
