{
  "schema_version": "1.0.0",
  "plant_id": 1019,
  "source": {
    "raw_file": "raw/plant_1019.html",
    "metadata_file": "metadata/plant_1019.json",
    "endpoint": "https://zd.plantdata.athsoftware.com/Home/GetDashboardData?plantId=1019",
    "http_status": 200,
    "dropdown_label": "Aarti Industries Limited - Neo Division - 2404 (SPRO)  - 200W"
  },
  "plant": {
    "name": "aarti industries limited - neo division",
    "serial_number": "2404",
    "capacity": "200w",
    "site_contact_number": "9376447934"
  },
  "zone": "Dahej",
  "modules": {
    "stage_1": "4(ST)",
    "stage_2": "4(ST)",
    "stage_3": "0",
    "stage_4": "0",
    "stage_5": "0",
    "total": "8"
  },
  "design_parameters": [
    {
      "position": 1,
      "name": "Feed Flow",
      "unit": "m³/Hr.",
      "unit_raw": "(m³/Hr.)",
      "value": "10"
    },
    {
      "position": 2,
      "name": "Feed Conductivity",
      "unit": "µS/CM",
      "unit_raw": "(µS/CM)",
      "value": "770"
    },
    {
      "position": 3,
      "name": "Feed TDS",
      "unit": "ppm",
      "unit_raw": "(ppm)",
      "value": "550"
    },
    {
      "position": 4,
      "name": "Feed COD",
      "unit": "mg/ltr.",
      "unit_raw": "(mg/ltr.)",
      "value": "0"
    },
    {
      "position": 5,
      "name": "Feed Hardness",
      "unit": "PPM",
      "unit_raw": "(PPM)",
      "value": "45"
    },
    {
      "position": 6,
      "name": "Feed Turbidity",
      "unit": "NTU",
      "unit_raw": "(NTU)",
      "value": "20"
    },
    {
      "position": 7,
      "name": "Permeate Flow",
      "unit": "m³/Hr.",
      "unit_raw": "(m³/Hr.)",
      "value": "8"
    },
    {
      "position": 8,
      "name": "Permeate Conductivity",
      "unit": "µS/CM",
      "unit_raw": "(µS/CM)",
      "value": "100"
    },
    {
      "position": 9,
      "name": "Permeate TDS",
      "unit": "ppm",
      "unit_raw": "(ppm)",
      "value": "50"
    },
    {
      "position": 10,
      "name": "Permeate COD",
      "unit": "mg/ltr.",
      "unit_raw": "(mg/ltr.)",
      "value": "0"
    },
    {
      "position": 11,
      "name": "Permeate Hardness",
      "unit": "mg/ltr.",
      "unit_raw": "(mg/ltr.)",
      "value": "0"
    },
    {
      "position": 12,
      "name": "Recovery",
      "unit": "%",
      "unit_raw": "(%)",
      "value": "80"
    }
  ],
  "pump_and_motor": [
    {
      "pump_code": "PK185",
      "pump_make": "GRUNDFOS",
      "pump_model": "CRN 10-",
      "motor_make": "GRUNDFOS",
      "motor_kw": "1.5",
      "motor_amp": "3.35"
    },
    {
      "pump_code": "PK3601",
      "pump_make": "GRUNDFOS",
      "pump_model": "CRN 10-20",
      "motor_make": "GRUNDFOS",
      "motor_kw": "7.5",
      "motor_amp": "14"
    },
    {
      "pump_code": "PK195",
      "pump_make": "GRUNDFOS",
      "pump_model": "CRN 10-3",
      "motor_make": "GRUNDFOS",
      "motor_kw": "1.1",
      "motor_amp": "2.3"
    }
  ],
  "instruments": [
    {
      "name": "Perm. Cond. Meter",
      "make": "EUTECH",
      "model": "ALPHA 560"
    },
    {
      "name": "Feed Flow Trans.",
      "make": "Kranti",
      "model": "NA"
    },
    {
      "name": "Perm. Flow Trans.",
      "make": "Kranti",
      "model": "NA"
    },
    {
      "name": "PS151",
      "make": "ORION",
      "model": "MZ-7 / MZ - 10"
    },
    {
      "name": "PS180",
      "make": "ORION",
      "model": "MZ-7 / MZ - 10"
    },
    {
      "name": "PS171",
      "make": "ORION",
      "model": "MZ-7 / MZ - 10"
    },
    {
      "name": "Pressure Gauge-1",
      "make": "MASS",
      "model": "0-10"
    },
    {
      "name": "Pressure Gauge-2",
      "make": "MASS",
      "model": "0-60"
    }
  ],
  "hmi_and_plc": [
    {
      "name": "HMI",
      "make": "Schneider",
      "model": "NA"
    },
    {
      "name": "PLC",
      "make": "Schneider",
      "model": "NA"
    }
  ],
  "vfd": null,
  "dosing_pumps": null,
  "hp_pump_accessories": [
    {
      "position": 1,
      "group": "Motor",
      "entries": [
        {
          "label": "Pully",
          "value": "NA"
        },
        {
          "label": "Tapper",
          "value": "NA"
        }
      ]
    },
    {
      "position": 2,
      "group": "Pump",
      "entries": [
        {
          "label": "Pully",
          "value": "NA"
        },
        {
          "label": "Tapper",
          "value": "NA"
        }
      ]
    },
    {
      "position": 3,
      "group": "Pulsation Damper",
      "entries": [
        {
          "label": null,
          "value": "NA"
        },
        {
          "label": null,
          "value": "NA"
        },
        {
          "label": "V-Belt",
          "value": "NA"
        }
      ]
    }
  ],
  "filters": [
    {
      "position": 1,
      "name": "Sand Filter",
      "values": [
        "NA",
        "NA",
        "NA",
        "NA"
      ]
    },
    {
      "position": 2,
      "name": "Bag Filter",
      "values": [
        "NA",
        "NA",
        "NA",
        "NA"
      ]
    },
    {
      "position": 3,
      "name": "Cartridge Filter",
      "values": [
        "SS",
        "30\" X 5 nos.",
        "NA",
        "ROCHEM"
      ]
    },
    {
      "position": 4,
      "name": "D/A Filter",
      "values": [
        "NA",
        "NA",
        "NA",
        "NA"
      ]
    }
  ],
  "legacy_counts": {
    "pump_and_motor": 3,
    "instruments": 8,
    "hmi_and_plc": 2,
    "vfd": null,
    "dosing_pumps": null,
    "hp_pump_accessories": 3,
    "filters": 4
  }
}
