{
  "schema_version": "1.0.0",
  "plant_id": 1014,
  "source": {
    "raw_file": "raw/plant_1014.html",
    "metadata_file": "metadata/plant_1014.json",
    "endpoint": "https://zd.plantdata.athsoftware.com/Home/GetDashboardData?plantId=1014",
    "http_status": 200,
    "dropdown_label": "Ipca Laboratories Limited - 3571 (SPRO)  - 70"
  },
  "plant": {
    "name": "ipca laboratories limited",
    "serial_number": "3571",
    "capacity": "70",
    "site_contact_number": "9376447933"
  },
  "zone": "Vadodara",
  "modules": {
    "stage_1": "2(ST)",
    "stage_2": "2(ST)",
    "stage_3": "0",
    "stage_4": "0",
    "stage_5": "0",
    "total": "4"
  },
  "design_parameters": [
    {
      "position": 1,
      "name": "Feed Flow",
      "unit": "m3/hr",
      "unit_raw": "(m3/hr)",
      "value": "3.75"
    },
    {
      "position": 2,
      "name": "Feed Conductivity",
      "unit": "µS/CM",
      "unit_raw": "(µS/CM)",
      "value": "3500"
    },
    {
      "position": 3,
      "name": "Feed TDS",
      "unit": "PPM",
      "unit_raw": "(PPM)",
      "value": "2500"
    },
    {
      "position": 4,
      "name": "Feed COD",
      "unit": "mg/ltr",
      "unit_raw": "(mg/ltr)",
      "value": "500"
    },
    {
      "position": 5,
      "name": "Feed Hardness",
      "unit": "PPM",
      "unit_raw": "(PPM)",
      "value": "NIL"
    },
    {
      "position": 6,
      "name": "Feed Turbidity",
      "unit": "NTU",
      "unit_raw": "(NTU)",
      "value": "N/A"
    },
    {
      "position": 7,
      "name": "Permeate Flow",
      "unit": "m3/Hr.",
      "unit_raw": "(m3/Hr.)",
      "value": "3.180"
    },
    {
      "position": 8,
      "name": "Permeate Conductivity",
      "unit": "µS/CM",
      "unit_raw": "(µS/CM)",
      "value": "250"
    },
    {
      "position": 9,
      "name": "Permeate TDS",
      "unit": "PPM",
      "unit_raw": "(PPM)",
      "value": "125"
    },
    {
      "position": 10,
      "name": "Permeate COD",
      "unit": "mg/ltr",
      "unit_raw": "(mg/ltr)",
      "value": "25"
    },
    {
      "position": 11,
      "name": "Permeate Hardness",
      "unit": "mg/ltr",
      "unit_raw": "(mg/ltr)",
      "value": "NIL"
    },
    {
      "position": 12,
      "name": "Recovery",
      "unit": "%",
      "unit_raw": "(%)",
      "value": "85"
    }
  ],
  "pump_and_motor": [
    {
      "pump_code": "PK121",
      "pump_make": "CLIENT SCOPE",
      "pump_model": null,
      "motor_make": "CLIENT SCOPE",
      "motor_kw": null,
      "motor_amp": null
    },
    {
      "pump_code": "PK131",
      "pump_make": "Grundfos",
      "pump_model": "CRN5-6",
      "motor_make": "GRUNDFOSE",
      "motor_kw": "1.1",
      "motor_amp": "2.2"
    },
    {
      "pump_code": "PK1601",
      "pump_make": "GRUNDFOSE",
      "pump_model": "CRN 5-36",
      "motor_make": "GRUNDFOSE",
      "motor_kw": "5.5",
      "motor_amp": "11"
    },
    {
      "pump_code": "PK195",
      "pump_make": "GRUNDFOS",
      "pump_model": "CRN 5-5",
      "motor_make": "Grundfos",
      "motor_kw": "0.75",
      "motor_amp": "1.9"
    }
  ],
  "instruments": [
    {
      "name": "Feed Flow Trans.",
      "make": "Georg Fischer",
      "model": "2536-P0"
    },
    {
      "name": "Perm. Flow Trans.",
      "make": "Georg Fischer",
      "model": "2536-P0"
    },
    {
      "name": "Perm. Cond. Meter",
      "make": "EUTECH",
      "model": "THERMO ALPHA 560"
    },
    {
      "name": "SMCV",
      "make": "GLOBE VALVE",
      "model": null
    },
    {
      "name": "PS151",
      "make": "ORION",
      "model": "MZ7/10"
    },
    {
      "name": "PS171",
      "make": "ORION",
      "model": "MZ7/10"
    },
    {
      "name": "PS180",
      "make": "ORION",
      "model": "MZ7/10"
    }
  ],
  "hmi_and_plc": [
    {
      "name": "HMI",
      "make": "SCHNIEDER",
      "model": "GXU-3512"
    },
    {
      "name": "PLC",
      "make": "SCHNIEDER",
      "model": "TM200C40T"
    }
  ],
  "vfd": null,
  "dosing_pumps": [
    {
      "dosing_pump_for": "HCL",
      "make": "N/A",
      "model": "N/A"
    },
    {
      "dosing_pump_for": "ANTISCALANT",
      "make": "PROMINENT",
      "model": "PsMa10010"
    }
  ],
  "hp_pump_accessories": null,
  "filters": [
    {
      "position": 1,
      "name": "Sand Filter",
      "values": [
        "1354",
        "1NOS",
        "NA",
        "NA"
      ]
    },
    {
      "position": 2,
      "name": "Cartridge Filter",
      "values": [
        "30\"",
        "1NOS",
        "NA",
        "NA"
      ]
    },
    {
      "position": 3,
      "name": "D/A Filter",
      "values": [
        "1354",
        "2NOS",
        "NA",
        "NA"
      ]
    }
  ],
  "legacy_counts": {
    "pump_and_motor": 4,
    "instruments": 7,
    "hmi_and_plc": 2,
    "vfd": null,
    "dosing_pumps": 2,
    "hp_pump_accessories": null,
    "filters": 3
  }
}
