{
  "schema_version": "1.0.0",
  "plant_id": 1148,
  "source": {
    "raw_file": "raw/plant_1148.html",
    "metadata_file": "metadata/plant_1148.json",
    "endpoint": "https://zd.plantdata.athsoftware.com/Home/GetDashboardData?plantId=1148",
    "http_status": 200,
    "dropdown_label": "Sajjan India Limited - 2926 (SPRO)  - 300"
  },
  "plant": {
    "name": "sajjan india limited",
    "serial_number": "2926",
    "capacity": "300",
    "site_contact_number": "9376447923"
  },
  "zone": "Ankleshwar",
  "modules": {
    "stage_1": "10(SP)",
    "stage_2": "10(SP)",
    "stage_3": "0",
    "stage_4": "0",
    "stage_5": "0",
    "total": "20"
  },
  "design_parameters": [
    {
      "position": 1,
      "name": "Feed Flow",
      "unit": "m³/Hr",
      "unit_raw": "(m³/Hr)",
      "value": "15"
    },
    {
      "position": 2,
      "name": "Feed Conductivity",
      "unit": "µS/CM",
      "unit_raw": "(µS/CM)",
      "value": "1000"
    },
    {
      "position": 3,
      "name": "Feed TDS",
      "unit": "PPM",
      "unit_raw": "(PPM)",
      "value": "450"
    },
    {
      "position": 4,
      "name": "Feed COD",
      "unit": "PPM",
      "unit_raw": "(PPM)",
      "value": "NA"
    },
    {
      "position": 5,
      "name": "Feed Hardness",
      "unit": "PPM",
      "unit_raw": "(PPM)",
      "value": "NA"
    },
    {
      "position": 6,
      "name": "Feed Turbidity",
      "unit": "NTU",
      "unit_raw": "(NTU)",
      "value": "5"
    },
    {
      "position": 7,
      "name": "Permeate Flow",
      "unit": "m³/Hr",
      "unit_raw": "(m³/Hr)",
      "value": "13.5"
    },
    {
      "position": 8,
      "name": "Permeate Conductivity",
      "unit": "µS/CM",
      "unit_raw": "(µS/CM)",
      "value": "100"
    },
    {
      "position": 9,
      "name": "Permeate TDS",
      "unit": "PPM",
      "unit_raw": "(PPM)",
      "value": "50"
    },
    {
      "position": 10,
      "name": "Permeate COD",
      "unit": "PPM",
      "unit_raw": "(PPM)",
      "value": "NA"
    },
    {
      "position": 11,
      "name": "Permeate Hardness",
      "unit": "PPM",
      "unit_raw": "(PPM)",
      "value": "NA"
    },
    {
      "position": 12,
      "name": "Recovery",
      "unit": "%",
      "unit_raw": "(%)",
      "value": "90"
    }
  ],
  "pump_and_motor": [
    {
      "pump_code": "PK131",
      "pump_make": "GRUNDFOS",
      "pump_model": "CRN 15-4",
      "motor_make": "GRUNDFOS",
      "motor_kw": "3",
      "motor_amp": "6.3"
    },
    {
      "pump_code": "PK1601",
      "pump_make": "GRUNDFOS",
      "pump_model": "CRN 15-17",
      "motor_make": "GRUNDFOS",
      "motor_kw": "15",
      "motor_amp": "28"
    },
    {
      "pump_code": "PK195",
      "pump_make": "GRUNDFOS",
      "pump_model": "CRN 15-2",
      "motor_make": "GRUNDFOS",
      "motor_kw": "2.2",
      "motor_amp": "4.5"
    }
  ],
  "instruments": [
    {
      "name": "Feed Flow Trans.",
      "make": "Georg Fischer",
      "model": "3-2536-P0"
    },
    {
      "name": "Perm. Flow Trans.",
      "make": "Georg Fischer",
      "model": "3-2536-P0"
    },
    {
      "name": "Perm. Cond. Meter",
      "make": "DELACUA",
      "model": "PCC-043"
    }
  ],
  "hmi_and_plc": [
    {
      "name": "HMI & PLC",
      "make": "SCHNEIDER",
      "model": "HMIGXU3512"
    },
    {
      "name": "HMI & PLC",
      "make": "ALLEN BRADLEY",
      "model": "TM200CE40T"
    }
  ],
  "vfd": null,
  "dosing_pumps": [
    {
      "dosing_pump_for": "ANTISCALANT",
      "make": "E-DOSE",
      "model": "IMP 64"
    }
  ],
  "hp_pump_accessories": null,
  "filters": [
    {
      "position": 1,
      "name": "Cartridge Filter",
      "values": [
        "30\"",
        "NA",
        "NA",
        "NA"
      ]
    }
  ],
  "legacy_counts": {
    "pump_and_motor": 3,
    "instruments": 3,
    "hmi_and_plc": 2,
    "vfd": null,
    "dosing_pumps": 1,
    "hp_pump_accessories": null,
    "filters": 1
  }
}
